URL,NETLOC,PATH,TITLE,TIME_GMT,SCORE,STATUS
https://p.4cache.net/,p.4cache.net,/,"loads of misc and other from 4cache.net",1462994098,38,200
http://dl.tristanpiron.com/Deadpool%202016%201080p%20BluRay%20x264%20DTS-JYK/,dl.tristanpiron.com,/Deadpool%202016%201080p%20BluRay%20x264%20DTS-JYK/,"Deadpool 2016 1080p BluRay x264 DTS-JYK - that is all. (Parent directory has more.)",1462984930,54,401
https://wiki.installgentoo.com/images/,wiki.installgentoo.com,/images/,"All the images on the InstallGentoo wiki.",1462949017,19,200
http://eap.bl.uk/database/overview_project.a4d?projID=EAP468;r=41,eap.bl.uk,/database/overview_project.a4d,"Endangered Archives Programme: Large database of digitized shellac records of Indian music from 1912-1938",1462926715,20,200
http://kaosmaker.redirectme.net/PLEX/,kaosmaker.redirectme.net,/PLEX/,"Now here's a good time... Movies, music, TV shows",1462918568,40,
http://lemondemon.com/downloads/,lemondemon.com,/downloads/,"A few free Lemon Demon (Neil Cicierega) songs.",1462865033,23,200
https://github.com/jsvine/waybackpack,github.com,/jsvine/waybackpack,"Waybackpack - Download the entire Wayback Machine archive for a given URL.",1462843136,46,200
https://p.4cache.net/2016/,p.4cache.net,/2016/,"Lotta .webm's .....all NSFW",1462818616,97,200
http://64.94.101.118/SMDJ/music/,64.94.101.118,/SMDJ/music/,"A few MP3s",1462601209,29,200
http://217.219.143.104/9301/,217.219.143.104,/9301/,software,1462583369,29,
http://m.jizzman.com/t0rrentz/d0ne/,m.jizzman.com,/t0rrentz/d0ne/,"[NSFW] Some porn",1462176740,45,404
http://www.darkspin.com/tf/,www.darkspin.com,/tf/,"Another TF2 server, includes server-customized maps!",1461977167,2,200
http://dev.trabelsi.fr/,dev.trabelsi.fr,/,"Lots of books in french under /livres, some mangas and music.",1461947226,16,403
http://75.132.70.17/,75.132.70.17,/,"TF2 server, many pieces of server-side custom content available for download.",1461891629,17,200
https://ghostbin.com/paste/vngar,ghostbin.com,/paste/vngar,"The Directory Directory -- Some of the best directories I've found posted here with notes on almost all, some new ones, and a guide for beginners on how to find and download them, along with Google Drive and Mega.nz. By yours truly.",1461830451,159,406
http://103.63.159.38/data/English/?C=N;O=D,103.63.159.38,/data/English/,"Bunch of movies 1-2GB in size [8-13MB/s download]",1461813260,29,
http://www.muongold.com/muon/flv/,www.muongold.com,/muon/flv/,"Rather large collection of M4V movies. (FAST 5+ MB/sec download!)",1461772974,23,403
http://www.lacampanella.com/uploads/,www.lacampanella.com,/uploads/,"Some improperly secured midi/karaoke site? Even the '.htaccess' in the downloads directory is visible",1461740283,12,200
http://cloud.orangebananaspy.com/Movies/,cloud.orangebananaspy.com,/Movies/,"Small Mix of Movies",1461731424,29,200
http://patteguf.dk/assets/gallery/,patteguf.dk,/assets/gallery/,"Some kind of NSFW adult avatar CDN?",1461696135,41,200
http://www.starbase-929.net/media/Calibre%20Library/,www.starbase-929.net,/media/Calibre%20Library/,"lots of books various types and subjectes",1461584107,9,200
http://bangextreme.se/files/videos/videos/,bangextreme.se,/files/videos/videos/,"300TB of extreme brutal NSFW Stuff - Still there!",1461605549,8,200
http://files.transkon.net.id/,files.transkon.net.id,/,"Star wars TFA and various comic to real action TV",1461551794,24,403
http://schnivasdomain.greatlakeshosting.com/Soundtracks/,schnivasdomain.greatlakeshosting.com,/Soundtracks/,"A few great video game soundtracks.",1461512411,29,200
http://mhostingwebsolutions.com/,mhostingwebsolutions.com,/,"Lots of Movies + Music plus some TV Shows",1461496401,31,302
ftp://12.5.23.232/pub/,12.5.23.232,/pub/,"Lots of categorised software. Some licenses/keygens. Plenty under the Microsoft folder",1461287389,47,200
http://www.muongold.com/MV/,www.muongold.com,/MV/,"uncensored music clips",1461223474,9,404
http://ycribier.com/dt/downloads/,ycribier.com,/dt/downloads/,"some in english, other in french (movies, tv series, etc)",1461209609,13,404
http://itservices.anu.edu.au/_resources/it-security/,itservices.anu.edu.au,/_resources/it-security/,"IT Security?",1461193438,16,200
http://23.92.65.19/books/,23.92.65.19,/books/,"A small directory of scifi and fantasy ebooks (epub, pdf)",1461151634,38,404
http://users.du.se/~dbe/mp3/Star%20Wars%20Trilogy%20%28Original%20Motion%20Picture%20Soundtrack%29/,users.du.se,/~dbe/mp3/Star%20Wars%20Trilogy%20%28Original%20Motion%20Picture%20Soundtrack%29/,"Star Wars Trilogy Soundtracks",1461030509,27,200
http://mp3.tixorebel.ca/,mp3.tixorebel.ca,/,"more music",1460960686,13,
ftp://c-50-183-140-123.hsd1.co.comcast.net/Holly/Mp3/,c-50-183-140-123.hsd1.co.comcast.net,/Holly/Mp3/,"Indez A-Z ftp dex music.",1460934922,20,
http://files.dinoserv.info/seedbox/,files.dinoserv.info,/seedbox/,"Seedbox with couple movies, music and PDF.",1460922572,16,
https://www.irs.gov/pub/irs-pdf/,www.irs.gov,/pub/irs-pdf/,"Every IRS Tax Help PDF in one spot.",1460903923,40,200
http://michael.evanforbes.net:8080/files/private/music1,michael.evanforbes.net:8080,/files/private/music1,"Various music (Classic Rock, Trans-Siberian Orchestra, Video game tracks, LoTR soundtracks, as well as some newer stuff) Other stuff in higher directories that aren't as interesting.",1460899794,32,
http://www.autistici.org/sitosovversivo/uncensored/notes/,www.autistici.org,/sitosovversivo/uncensored/notes/,"Nikola Tesla patents and designs pdfs",1460878248,41,200
http://chemistry.mdma.ch/hiveboard/palladium/pdf/,chemistry.mdma.ch,/hiveboard/palladium/pdf/,"Chemical, Drug Documents (index of /hiveboard/palladium/pdf)",1460780456,22,200
http://www.otc.com.tw/rena/music/VA-The%20Great%20Gatsby%20SoundTrack[Deluxe%20Edition]%282013%29/,www.otc.com.tw,/rena/music/VA-The%20Great%20Gatsby%20SoundTrack[Deluxe%20Edition]%282013%29/,"""The Great Gatsby"" Soundtrack and other good music in parent. ""Together"" by XX and Lana's ""Young and Beautiful"" are the one to listen to.",1460748458,19,
http://dsgnblvd.com/m/,dsgnblvd.com,/m/,"six dEUS albums and other alternative/indie music",1460746782,14,200
http://www.vocabsushi.com/mp3words/,www.vocabsushi.com,/mp3words/,"A whole dictionary of synthesized words, their definitions, and example sentences, all in MP3's.",1460642318,23,403
http://videos2.qbie.com/Soundtracks/,videos2.qbie.com,/Soundtracks/,"Now, this is a bit weird - movie soundtracks with homemade clips",1460604627,42,200
http://jooh.no/web/,jooh.no,/web/,"Look in ""Tools"" folder",1460584784,43,200
http://188.165.223.196/node2/,188.165.223.196,/node2/,"Seedbox: Movies, TV shows, some software and small amount of NSFW.",1460533975,9,
http://jackbdirtyslutalert.com/Feb/,jackbdirtyslutalert.com,/Feb/,"[NSFW] Directory from an amateur adult site. Videos and pics.",1460553740,27,301
http://seedbox.mesnie.org/TonightsGirlfriend%20%5b2160p%5d/,seedbox.mesnie.org,/TonightsGirlfriend%20%5b2160p%5d/,"NSFW: Lots of Tonights GirlFriend movies, all 2160P, 8-9GB each. Other SFW Movies and TV shows in Parent directory.",1460532604,48,
http://img.funtasticusnsfw.com/wp/wp-content/uploads/photozip/,img.funtasticusnsfw.com,/wp/wp-content/uploads/photozip/,"NSFW: Decent collection of pics, medium res., sorted, good speeds. Amateurs & Porno-stars",1460531841,15,200
https://www.flashgames247.com/games/,www.flashgames247.com,/games/,"Massive selection of Flash games (SWF). Many older ones.",1460527674,6,302
http://www.filechef.com/,www.filechef.com,/,"Direct download almost anything. A great open directory search tool.",1460520471,157,200
http://hudsoncress.net/hudsoncress.org/html/library/western-philosophy/,hudsoncress.net,/hudsoncress.org/html/library/western-philosophy/,"Index of /hudsoncress.org/html/library/western-philosophy",1460518355,12,200
http://dl2.download.ir/Download/2014/January/Movie/Animation/,dl2.download.ir,/Download/2014/January/Movie/Animation/,"Some Disney Movie Classics",1460432338,40,302
http://shadowserver01.servebeer.com/Games/,shadowserver01.servebeer.com,/Games/,"KSP, GTA:SA, Papers, Please, and other misc games",1460425036,9,
http://fire.applmat.ru/~homutovsky/Rock/,fire.applmat.ru,/~homutovsky/Rock/,"Nicely organised music all sorts",1460423967,28,200
http://eurl.deblasis.info/dvx/,eurl.deblasis.info,/dvx/,"Movies and tv shows, nice speeds",1460416706,13,
http://www.film4eg.net/,www.film4eg.net,/,"Extensive list of new movies (across three dirs)",1460416559,25,
http://floatingworldweb.com/MUSIC/@ELECTRONICA/@DJ%20MIXES/,floatingworldweb.com,/MUSIC/@ELECTRONICA/@DJ%20MIXES/,"Index of /MUSIC/@ELECTRONICA/@DJ MIXES",1460400086,19,200
http://www.mmnt.net/db/0/0/76.23.52.7/AiDisk_a1/eBooks/,www.mmnt.net,/db/0/0/76.23.52.7/AiDisk_a1/eBooks/,"A lot of e-books on this FTP server but I don't know how to download them",1460334957,11,200
http://www.forensic-applications.com/meth/,www.forensic-applications.com,/meth/,"PDFs and drug-related stuff",1460324434,23,200
ftp://201.217.60.194/,201.217.60.194,/,"Someone's software archive. Nothing really interesting, but it's fun to look around.",1460319532,28,200
http://satdude.com/4don/[ebooks]%201000+%20ScienceFiction%20&%20Fantasy%20Novels%20(.lit%20format)/,satdude.com,/4don/[ebooks]%201000+%20ScienceFiction%20&%20Fantasy%20Novels%20(.lit%20format)/,"1000+ Science Fiction & Fantasy Novels in .lit format",1460215976,44,404
http://soleil.i4ds.ch/solarradio/callistoQuicklooks/?date=20140108,soleil.i4ds.ch,/solarradio/callistoQuicklooks/,"data callisto",1460117072,18,200
http://iusethis.luo.ma,iusethis.luo.ma,"","A huge collection of Mac OS X software. Older versions in separate folders. Mostly free/shareware, no serials. Gotta respect the dedication though.",1460097218,14,200
http://www.zen134237.zen.co.uk/,www.zen134237.zen.co.uk,/,"Transcripts, hundreds of them.",1460095915,29,200
http://www.dhammatalks.net/mobile_books/,www.dhammatalks.net,/mobile_books/,"Some Buddhist literature in mobi and epub format",1460083731,23,200
https://839erjkfhio9y3u4jtjgiou.bookz.lt/Epub/,839erjkfhio9y3u4jtjgiou.bookz.lt,/Epub/,"Huge number of Epubs. Mostly in Spanish",1460083033,29,503
http://217.219.143.108/1384/,217.219.143.108,/1384/,"""Elephant"", ""Down by Law"", ""Cashback"" and other good movies.",1460082318,14,
http://morlane.net/epubs/,morlane.net,/epubs/,"SF and Fantasy epubs",1460081051,19,200
http://beq.ebooksgratuits.com/vents-epub/,beq.ebooksgratuits.com,/vents-epub/,"Epubs in french. Mostly classics",1460053562,25,200
http://www.digitaldreamart.com/storage/600.iBooks.for.iPhone.iPad.TL/,www.digitaldreamart.com,/storage/600.iBooks.for.iPhone.iPad.TL/,600.iBooks.for.iPhone.iPad.TL,1460013208,33,404
http://www.abunai.com/music/,www.abunai.com,/music/,"A lot of different music grouped by artist in alphabetical order",1459976073,15,200
http://annescatto.com/anneftp/,annescatto.com,/anneftp/,"Some old music",1459972579,21,200
http://www.torontoravemixtapearchive.com/files/x-static/,www.torontoravemixtapearchive.com,/files/x-static/,"rave mp3",1459962684,41,200
http://sd-41445.dedibox.fr/,sd-41445.dedibox.fr,/,SeedBox,1459881736,32,
http://www.wallpaperindex.com/wallpapers/,www.wallpaperindex.com,/wallpapers/,"Gazillion Wallpapers....",1459818080,21,200
http://209.126.108.87/series/,209.126.108.87,/series/,"Index of /series",1459740997,8,200
https://drive.google.com/folderview?id=0BzQJzw2V271wYTJna0VoMVZVaXc&usp=sharing,drive.google.com,/folderview,"Google Drive share with lots of comics",1459792787,85,400
http://trauma.org/images/image_library/,trauma.org,/images/image_library/,"Very Graphic Medical images",1459752225,26,200
http://arcarc.xmission.com/Pinball/,arcarc.xmission.com,/Pinball/,"Manuals, Schematics and other stuff related do Pinball machines",1459732002,41,200
http://ns323777.ip-91-121-3.eu/PS1/,ns323777.ip-91-121-3.eu,/PS1/,"PS1(PSX) roms",1459631953,63,200
http://psf2.joshw.info/,psf2.joshw.info,/,"So many PS2 roms",1459554869,51,200
http://dl.softrayane.ir/,dl.softrayane.ir,/,"All sorts of software, well organized + some design trainings",1459468461,23,200
http://123.1.149.29:8008/python/,123.1.149.29:8008,/python/,"Small, useful collection of Python ebooks (with some other stuff). The hack/ directory is especially interesting.",1459468421,53,
http://federaljack.com/mindcontrol/,federaljack.com,/mindcontrol/,"Videos, audio and books on.. Mind control!",1459465785,13,200
http://223.29.212.2/data/,223.29.212.2,/data/,"Bunch of movies, mostly in the disk2 sub",1459442486,20,200
http://122.3.252.180/,122.3.252.180,/,"Someone's torrent dump I think. Assorted Movies, Music, Games, Applications",1459353727,36,
http://porni.com/anna/,porni.com,/anna/,"Average Open Directory With Naked Women NSFW",1459291724,40,404
http://webserv.melnikovsm.tk/data/DIST/GAMES/LINUX/,webserv.melnikovsm.tk,/data/DIST/GAMES/LINUX/,"Russian OD, with Linux Valve games in English. There is some other stuff in Russian in the parents, but I'm not sure what most of it is.",1459132477,2,200
http://www.pedrocosta.pt/port/photos/,www.pedrocosta.pt,/port/photos/,"Photographers Site - Mildly NSFW",1459190377,18,404
http://brzhk.info/jdownloader/La%20Bibbia%20v3.0/,brzhk.info,/jdownloader/La%20Bibbia%20v3.0/,"Italian (I think) Selfies (NSFW)",1459190134,77,
http://cdenz.com/cjtml/admin/videos/,cdenz.com,/cjtml/admin/videos/,"Just Indians Having Fun....",1459153598,19,200
http://www.markboulder.com/CONTENT/media/videonotmovies/,www.markboulder.com,/CONTENT/media/videonotmovies/,"What have I stumbled into? (SFW)",1459077448,35,200
http://peliculator.com/torrents/subs/,peliculator.com,/torrents/subs/,"English subtitles to a bunch of movies",1458994269,11,200
http://dl.movieo.ir/dlha/files/,dl.movieo.ir,/dlha/files/,"Tons of movies. Tv one level up in series.",1458994063,50,200
http://dl.dlroozane.ir/dlroozane/95/1/,dl.dlroozane.ir,/dlroozane/95/1/,"Deadpool, starwars and many others. Tons of directories up a few. SLOW",1458948698,69,
http://www.miketyndall.com/littlekuriboh/,www.miketyndall.com,/littlekuriboh/,"LittleKuriboh Directory (Makes Abridged Series for Yu-Gi-Oh, Naruto, Etc)",1458904263,7,200
http://likecool.com/Gear/,likecool.com,/Gear/,"Not sure what this is but tons of it",1458885013,10,200
"http://serv.yanchick.org/Books/Cisco%20Collection%20CCNA,%20CCNP,%20CCIP,%20CCIE,%20CCDP,%20CCDA/",serv.yanchick.org,"/Books/Cisco%20Collection%20CCNA,%20CCNP,%20CCIP,%20CCIE,%20CCDP,%20CCDA/","Cisco Networking eBook Collection [CCNA, CCNP, CCIP, CCIE, CCDP, CCDA]",1458876955,62,301
http://dreamsupport.us/downloads/,dreamsupport.us,/downloads/,"Windows/Mac OS X retail software / Legacy OSes+wares",1458813138,29,503
http://www.digitalvagabonding.com/wp-content/gallery/,www.digitalvagabonding.com,/wp-content/gallery/,"Hippie Travelogue",1458810584,5,200
http://stealmylyrics.com/ftp/djmattbailer/,stealmylyrics.com,/ftp/djmattbailer/,"Lots of music singles...",1458772157,23,404
http://dl2.film2movie.info/serial/,dl2.film2movie.info,/serial/,"A handful of good TV Series, 480p & 720p, Fast.",1458749241,32,200
http://jumpjet.info/,jumpjet.info,/,"Emergency preparedness, early days of radio technology, lots of software, and other goodies",1458693588,29,200
http://ebook.nscpolteksby.ac.id/files/Ebook/,ebook.nscpolteksby.ac.id,/files/Ebook/,"HUGE eBook Database [Accounting, Business Administration, Computer Engineering, Hospitality...]",1458692874,59,200
http://dl.pars3d.com/,dl.pars3d.com,/,"A ton of 3D movies and videos, and a couple of subdirectories with random files.",1458686101,5,200
http://share724.com/user2/1393/,share724.com,/user2/1393/,"SO> MUCH> STUFF> && recently modified",1458652868,15,200
http://onplayers.com/games/,onplayers.com,/games/,"An insane amount of Flash games.",1458631586,47,200
http://cyberclass.net/serenityglobalfiles/,cyberclass.net,/serenityglobalfiles/,"conspiracy stuff",1458520343,3,301
http://ftp.tudelft.nl/TUDelft/SIDdesk/ToolKit/CDImages/,ftp.tudelft.nl,/TUDelft/SIDdesk/ToolKit/CDImages/,"FTP server of Dutch University of Technology Delft (I've directly linked to their Windows Disk Image folder, but maybe there's more?)",1458505343,47,404
http://dlna.digitalk7.com/mus/,dlna.digitalk7.com,/mus/,"Nice Music mix Dex.",1458451461,22,
http://infomotions.com/sandbox/great-books-redux/corpus/,infomotions.com,/sandbox/great-books-redux/corpus/,"Some Html and Epub books. Also contains other stuff higher up.",1458444212,11,200
https://www.frikfry.com/books/,www.frikfry.com,/books/,"Extensive ebook dir",1458384149,40,404
http://www.protoman.com/Music/Music/,www.protoman.com,/Music/Music/,"100 Folders of Videogame Music",1458353099,75,200
https://synfin.org/comics/,synfin.org,/comics/,"Hellblazer, Daredevil, Deadpool, and other comics",1458259819,62,200
http://leethomson.myzen.co.uk/,leethomson.myzen.co.uk,/,"Television scripts, both pilots and ongoing shows",1458259733,24,200
http://188.165.223.196/node2/?C=M;O=A,188.165.223.196,/node2/,"Deadpool, Big Bang Theory and more",1458111686,8,
http://www.mmnt.net/index.31.html,www.mmnt.net,/index.31.html,"No Idea...But Interesting....",1458151499,0,200
http://www.eeldl.com/,www.eeldl.com,/,"An ocean of coding/dev PDFs",1458102908,65,200
http://vic.kim/downloads/01%20Completed/,vic.kim,/downloads/01%20Completed/,"Recent movies, and other goodies",1458102710,15,
http://tvshowsapp.com/feeds/,tvshowsapp.com,/feeds/,"Torrent URLs and Magnet links for TV Series, saved in XML files.",1458100177,13,200
http://potter-pod.com/Five%20Star%20Books%20(EPUB)/EPUB/,potter-pod.com,/Five%20Star%20Books%20(EPUB)/EPUB/,"A few random ebooks (epub)",1458086855,18,200
http://www.3d-thai.com/work/,www.3d-thai.com,/work/,"Bunch of 3D movies and videos, and some possibly 2D stuff too.",1458061482,16,302
http://siriusgame.ddns.net/gizcloud/,siriusgame.ddns.net,/gizcloud/,"LBOE...Games, Docs, Music, Apps....",1457753895,21,
http://www.thingiverse.com/CosmoWenman/collections,www.thingiverse.com,/CosmoWenman/collections,"3D Objects of Famous Sculptures",1457727126,26,200
http://www.shadowsgovernment.com/shadows-library/,www.shadowsgovernment.com,/shadows-library/,"Even more eBooks.",1457670861,53,200
http://unixquest.com/Files/Kindle/,unixquest.com,/Files/Kindle/,"Kindle eBook library (7.58GB RAR Archive)",1457581835,86,404
http://prograweb78.com/Ingeniero/,prograweb78.com,/Ingeniero/,"Mostly Business Infographics",1457532955,7,
http://rjaquino.ph/downloads/Kindle%20Library%2012-26-10/Library/,rjaquino.ph,/downloads/Kindle%20Library%2012-26-10/Library/,"Kindle eBook library",1457506576,46,404
http://d2.dev.home.nnoel.com/,d2.dev.home.nnoel.com,/,"More movies. Great DL speed.",1457506386,25,
http://media.comicyu.com/movie2010/media/,media.comicyu.com,/movie2010/media/,Animations?,1457464589,7,200
http://berloga50.static.corbina.ru/Wagner/,berloga50.static.corbina.ru,/Wagner/,Wagner,1457406231,35,200
http://danishios.pw/bizcasual/,danishios.pw,/bizcasual/,"[Music] Tons of Vaporwave, Memewave, Hypnagogic, etc.",1457329249,44,200
https://themis.feralhosting.com/saiyuki/links/videos/,themis.feralhosting.com,/saiyuki/links/videos/,"Information Technology Help Videos",1457203574,30,502
http://sv2.dl-pars.in/bia2/Movies/Archive/,sv2.dl-pars.in,/bia2/Movies/Archive/,"Movie Directory and TV Series.. decent list",1457183285,13,
https://web.archive.org/web/20090501032455/http://www.littlehits.com/songoftheday/,web.archive.org,/web/20090501032455/http://www.littlehits.com/songoftheday/,"I just found out that archive.org has cached the entire ""Song Of The Day"" folder from the defunct blog LittleHits.com. This is chock full of the most obscure singles from the 80s-90s.",1457160451,145,200
https://drive.google.com/folderview?id=0B35IhzVzh2U5bVd3RXNBTFhYdXM&usp=sharing,drive.google.com,/folderview,"JOY DIVISION",1457151520,16,400
http://nsrdl.com/apps/,nsrdl.com,/apps/,"Software -- circa 2008-2013",1457138917,5,200
http://hmd.naturalbd.com:81/,hmd.naturalbd.com:81,/,"A crapload of movies. Very good speeds for now.",1457126606,50,
http://techdmh.com/fichiers/,techdmh.com,/fichiers/,"15MBps, lots of movies",1457097788,20,200
http://slackwise.net/files/images/,slackwise.net,/files/images/,"A small collection of reaction pictures.",1457010321,5,200
http://www.jamiedole.com/music/,www.jamiedole.com,/music/,"Small collection of music. (And the music from Book of Mormon!)",1457009295,14,200
http://www.federaljack.com/ebooks/,www.federaljack.com,/ebooks/,"A ton of PDFs on conspiracies and the military.",1457000812,46,200
http://torrent.hackjela.com/node2/,torrent.hackjela.com,/node2/,"Games and pron and more...some NSFW",1456901564,18,
https://gist.github.com/3185805,gist.github.com,/3185805,"A small python script to download all of the epubs from a calabre library.",1343383762,1,302
http://dl2.melidl.com/,dl2.melidl.com,/,"Mostly Software",1456560324,34,200
http://www.movie-inn.com/content/,www.movie-inn.com,/content/,"Huge directory of movies and TV shows.",1456458877,36,404
http://ro.uow.edu.au/ozlondon/,ro.uow.edu.au,/ozlondon/,"Every issue of OZ, the influential psychedelic underground newspaper that was published in London between 1967 and 1973",1456421412,82,200
http://ns.cheponis.com/Video/,ns.cheponis.com,/Video/,"Mix of movies and series, some direct rips.",1456404514,18,200
http://dl2.saberfun.ir/mersad/serial/,dl2.saberfun.ir,/mersad/serial/,"Serials movies and games",1456356343,13,
http://photos.state.gov/libraries/amgov/30145/publications-english/,photos.state.gov,/libraries/amgov/30145/publications-english/,"Some government pamphlets on everything from Muslims to Disabled People",1456306633,39,200
http://fun.bgjargon.com/funny/,fun.bgjargon.com,/funny/,"Well, It's a Funny Folder",1456220361,20,200
http://www.erratum.org/datas/,www.erratum.org,/datas/,"Arty music and films",1456187987,11,200
http://www.chicasxxxweb.com/wp-content/uploads/,www.chicasxxxweb.com,/wp-content/uploads/,"StumbledUpon these ""Chicas."" Many [NSFW]. Try the /2013/12 Directory for starters.",1456183416,21,403
http://www.oceanbound.com/Misc.Uploads/fakebooks,www.oceanbound.com,/Misc.Uploads/fakebooks,"A few ""fake books""",1456117016,48,404
http://landsurvival.com/mad/,landsurvival.com,/mad/,"Every MAD Magazine Ever, organized by decade (PDFs)",1456062151,130,404
ftp://87.79.71.42/,87.79.71.42,/,"A Bunch of Old Games and software- Almost all For Ms-DOS.",1456054457,26,
https://server.filozofia.bme.hu/stuff/History%20of%20World%20since%201300/?_e_pi_=7%2CPAGE_ID10%2C4295634345,server.filozofia.bme.hu,/stuff/History%20of%20World%20since%201300/,"HISTORY OF THE WORLD SINCE 1300",1455921175,26,404
http://cdn.serieswatch.tv/1/,cdn.serieswatch.tv,/1/,"TV SERIES & MOVIES MIX...",1455920899,15,302
http://videocelebrities.eu/wp-content/uploads/,videocelebrities.eu,/wp-content/uploads/,"Celebrity Oops-See Thru-Etc NSFW",1455911411,63,403
http://dl.avadl.com/New3/,dl.avadl.com,/New3/,"a lot of stuff - movies, tv, games, etc...",1455849215,18,200
http://helsinki.tv7.fi/public/,helsinki.tv7.fi,/public/,"All TV shows from a Finnish fundamentalist christian channel",1455747023,9,200
http://mp3.servebbs.org/,mp3.servebbs.org,/,"A to Z music",1455738408,31,
http://www.nickscipio.com/pod/media/,www.nickscipio.com,/pod/media/,"Some Sexy-Some Funny-Some NSFW",1455689266,23,200
http://cloud.orangebananaspy.com/Music/Kanye%20West/Kanye%20West%20-%20The%20Life%20Of%20Pablo%20%5bLIVE%20RIP%5d%20%5b2016%5d/,cloud.orangebananaspy.com,/Music/Kanye%20West/Kanye%20West%20-%20The%20Life%20Of%20Pablo%20%5bLIVE%20RIP%5d%20%5b2016%5d/,"Kayne West - The Life of Pablo (and other music in parent)",1455677295,28,404
http://admin.fetishbox.com/media/videos/,admin.fetishbox.com,/media/videos/,"[NSFW] Lots of fetish videos",1455672397,16,200
http://www.bang.vn/ezupload/,www.bang.vn,/ezupload/,"Lotta Hi Rez Images - I Mean a Lotta",1455650768,14,200
http://dl.film2movie.info/serial/,dl.film2movie.info,/serial/,"Some TV shows, all mkv. Not too many,but up to 1080p.",1455642770,41,200
http://blep.no-ip.org/dox/Teenage%20Mutant%20Ninja%20Turtles%20-%20Comic%20Books/,blep.no-ip.org,/dox/Teenage%20Mutant%20Ninja%20Turtles%20-%20Comic%20Books/,"TMNT Comics and other stuff in parent",1455625691,14,
http://www.greatnorthernprepper.com/wp-content/uploads/2013/01/,www.greatnorthernprepper.com,/wp-content/uploads/2013/01/,"Some more survival PDFs.",1455624268,20,302
https://murdercube.com/files/,murdercube.com,/files/,"PDF's related to everything (mainly survival).",1455623318,8,200
http://ruby.g2anime.net/media/P/Pokemon/,ruby.g2anime.net,/media/P/Pokemon/,"Pokemon Anime - Dubbed - Episodes 1-422",1455617418,43,404
http://12.228.222.153/Movies/,12.228.222.153,/Movies/,"Few Films and More - Fast DL",1455570226,22,200
http://artax.karlin.mff.cuni.cz/~gurss5am/rpo/,artax.karlin.mff.cuni.cz,/~gurss5am/rpo/,"Ready Player One",1455533011,33,200
http://scintillea.com/animes/,scintillea.com,/animes/,"some animes",1455421936,16,
http://198.50.198.85/ISTAR-Multimedia/,198.50.198.85,/ISTAR-Multimedia/,"Index of /ISTAR-Multimedia (Some streaming website?)",1455261211,20,200
http://dl2.my98music.com/Data/Serial/,dl2.my98music.com,/Data/Serial/,"TV Series (and MANY other things if you go one dir up)",1455184561,61,200
http://www.superheroinecentral.com/~wizard/Contributors/,www.superheroinecentral.com,/~wizard/Contributors/,"Super Heroines! (NSFW)",1455181805,0,200
http://cloud.orangebananaspy.com/Tv%20shows/Dragon%20Ball%20Z/,cloud.orangebananaspy.com,/Tv%20shows/Dragon%20Ball%20Z/,DragonballZ,1455114981,52,200
http://103.25.120.119:8081/,103.25.120.119:8081,/,"Games, TV, Software & Lot's in the Movies",1454982122,18,
ftp://ftp.us.dell.com/video/,ftp.us.dell.com,/video/,"Pretty much ever DELL Video Driver from 1996 to 2012.",1454981705,83,200
https://www.autigers.org/file/mac/Friends/,www.autigers.org,/file/mac/Friends/,"Friends(with transcripts)",1454954829,11,
http://dl1.ariafilm.in/,dl1.ariafilm.in,/,"dl1.ariafilm.in , decently fast",1454951414,7,301
