URL,NETLOC,PATH,TITLE,TIME_GMT,SCORE,STATUS
http://www.fzmovies.net/files/,www.fzmovies.net,/files/,"Over 2000 Hollywood and Bollywood movies formatted for your phone/tablet (.3gp/.mp4)",1356933293,42,200
http://lostingibberish.com/files/ebooks/Huge%20Collection%20Of%20General%20Computer%20Ebooks/Ebooks/,lostingibberish.com,/files/ebooks/Huge%20Collection%20Of%20General%20Computer%20Ebooks/Ebooks/,"Collection Of General Computer Ebooks (pdf|chm)",1357038372,17,
http://dpena.viper.feralhosting.com/Gentoomen%20Library/,dpena.viper.feralhosting.com,/Gentoomen%20Library/,"Many Ebooks: Everything from Algorithms to Computer History (pdf)",1357037531,42,301
http://www.28minton.com/Albums/,www.28minton.com,/Albums/,"Lots of full albums in mp3 format",1357011166,16,
http://64.250.127.229/,64.250.127.229,/,"20,500 ebooks. Technically not an open directory, but dem books.",1357006310,105,
http://typhon.svo.co.za/lyall/MOBI/,typhon.svo.co.za,/lyall/MOBI/,"1,700 Authors Organized A-Z (MOBI format)",1357003124,17,404
http://hartco.blogsite.org/downloads/,hartco.blogsite.org,/downloads/,"Random assorted tutorial books",1357108806,17,
http://www.hackerzlair.org/software/2/,www.hackerzlair.org,/software/2/,"Misc Hacking Software (A few years old)",1357099495,34,404
http://www.unorth.k12.in.us/HS/curriculum/online/,www.unorth.k12.in.us,/HS/curriculum/online/,"Various technical and study books. The woodworking ones are quite interesting. Didn't browse the others.",1357087704,15,404
http://krishome.selfip.info/browse,krishome.selfip.info,/browse,"Open Calibre library with 28238 e-books.",1357190415,54,
http://indylan.com/stuff/EBooks/Top%20Books%20of%202011/MOBI%20(Kindle)/,indylan.com,/stuff/EBooks/Top%20Books%20of%202011/MOBI%20(Kindle)/,"Some .mobi files",1357324715,35,404
http://theopensourcelibrary.org/,theopensourcelibrary.org,/,"Some books, films, and music in a cool interface",1357388943,21,401
http://mcn.sonicrules.org/patches/,mcn.sonicrules.org,/patches/,"Old versions of Minecraft",1357464179,24,302
http://www.lookpink.com/games/swfs/,www.lookpink.com,/games/swfs/,"Large directory of Flash, Shockwave Games",1357448123,14,302
"http://home.arcaism.com/ebooks/O'Reilly%20Media/",home.arcaism.com,"/ebooks/O'Reilly%20Media/","O'Reilly Media Ebooks (pdf)",1357536395,20,404
http://biblioteca.laboratorioschontalpa.com.mx/Pragmatic%20Programmers/,biblioteca.laboratorioschontalpa.com.mx,/Pragmatic%20Programmers/,"Pragmatic Programmers (pdf)",1357529138,2,
http://akademik.del.ac.id/ebooks/,akademik.del.ac.id,/ebooks/,"Directory of IT and Programming Ebooks",1357681238,37,404
http://www.rollanet.org/~n0klu/Ham_Radio/,www.rollanet.org,/~n0klu/Ham_Radio/,"Directory of Ham Radio Books and Related Files",1357611785,14,200
http://swollenbeef.dyndns.org,swollenbeef.dyndns.org,"","Mix of Content: Movies, TV, Audio Books & Games",1357861011,36,
http://rpg.go-ghoti.com/,rpg.go-ghoti.com,/,"RPG Books and Misc RPG Files Archive",1357946968,30,200
http://vack.goldblatt.net/thebox/,vack.goldblatt.net,/thebox/,"Mix of Dr. Who Videos & Programs",1357912708,19,
http://files4.fm420.com/music1/,files4.fm420.com,/music1/,"Bollywood music",1358017494,19,
http://pdf.textfiles.com/manuals/AUTOMOBILE/NISSAN/,pdf.textfiles.com,/manuals/AUTOMOBILE/NISSAN/,"Probably limited market for this one, but mechanic service manuals for most Nissan/Datsun vehicles up to 2009 (pdf). ",1358078096,89,200
http://w.bwex.net/abandonware.fundevils.net/,w.bwex.net,/abandonware.fundevils.net/,"Abandonware Older PC Games",1358287477,59,404
http://www.futuretg.com/FTHumanEvolutionCourse/FTFreeLearningKits/A_Sciences=Xioqua/,www.futuretg.com,/FTHumanEvolutionCourse/FTFreeLearningKits/A_Sciences=Xioqua/,"Ebooks: Everything from Physics to Programming (pdf | chm)",1358211099,47,404
http://virtualorg.ru/anime/,virtualorg.ru,/anime/,"A lot of anime videos",1358317736,72,
http://www.skjorestad.net/xbmc/,www.skjorestad.net,/xbmc/,"Movies and TV Shows (full seasons of friends, the wire, sopranos, nypd blue)",1358317104,17,
http://zxt2grenier.free.fr/Grenier/,zxt2grenier.free.fr,/Grenier/,"Small collection of Vintage Apple Macintosh Games and Apps",1358482511,24,403
http://corehz.fr/files/torrent/,corehz.fr,/files/torrent/,"Small Selection of Movies, TV, Games, Music, Audio Books",1358713658,32,
http://bookos.org/,bookos.org,/,"Not an OD, but over 2 Million ebooks. ",1358858238,140,403
http://media.leblogsexe.com/,media.leblogsexe.com,/,"Sex blog's images, short clips, and other various media [NSFW]",1358827335,26,302
http://www.chicojogos.com.br/Smallville%20Season%201%20-%2010%20+%20Extras%20DVDRip%20TSV/,www.chicojogos.com.br,/Smallville%20Season%201%20-%2010%20+%20Extras%20DVDRip%20TSV/,"Smallville - Complete 10 Seasons (including extras + unaired pilot + unaired pilot of ""Aquaman"")",1359400475,61,
http://www.world-sextoys.com/blog/uimg/show-tits/,www.world-sextoys.com,/blog/uimg/show-tits/,"Show your tits swf [NSFW]",1359472829,6,302
http://rumahadattradisionalindonesia.blogspot.com/,rumahadattradisionalindonesia.blogspot.com,/,"Rumah Adat Tradisional Indonesia",1359635108,0,302
http://www.mp3waxx.com/jobfolders/,www.mp3waxx.com,/jobfolders/,"Lots of music, looks like mostly rap/hip hop/R&B",1359725155,17,301
http://www.fxf1.com/english-books/,www.fxf1.com,/english-books/,"LOTS of investing related books",1359724383,19,403
http://asai.dyndns.org/filmdatabase/,asai.dyndns.org,/filmdatabase/,"Lots of neatly-organized videos here. Check the /disk#/Filmer/ directories.",1360045258,36,
http://archive.org/details/etree,archive.org,/details/etree,"Live Music Archive: Tons of live audio recordings of shows from well known artists.",1360135707,26,301
http://ncd.dyndns.biz,ncd.dyndns.biz,"","Seedbox, TV Shows Mainly",1360512915,23,
http://revistes.upc.es/~booby/cartoon/,revistes.upc.es,/~booby/cartoon/,"Various full seasons of cartoons (Adventure Time, The Venture Bros, ReBoot, My Little Pony, Regular Show)",1360456618,68,404
http://mirrors.rit.edu/,mirrors.rit.edu,/,"Stumbled across this from a gif, not really sure whats all there.",1360745218,21,200
ftp://ftp.itb.ac.id/pub/download/ebooks/,ftp.itb.ac.id,/pub/download/ebooks/,"[FTP] Mixed bag of eBooks (Mostly chemistry, computing, mechanics, management)",1360873827,42,
http://www.radford.edu/~sk-clb/,www.radford.edu,/~sk-clb/,"Sorority Girl Pictures (SFW)",1361000061,0,200
https://rtu.baikaldialog.ru.nyud.neymedia/videofilms/,rtu.baikaldialog.ru.nyud.neymedia,/videofilms/,"Russian... Lots of titles, don't know if they're in English ",1361227252,15,
https://sd-36548.dedibox.fr/LIVRES/,sd-36548.dedibox.fr,/LIVRES/,"Comic directory with a decent selection. Ranging from Marvel to Frank Miller.",1361159677,38,
http://mikeb.ath.cx/1VIDEOS/,mikeb.ath.cx,/1VIDEOS/,"Every single episode of: Bill Nye The Science Guy, Star Trek: TNG, and Top Gear. Oh, and some movies too!",1361254190,125,
http://mmoser.cinnabar.feralhosting.com/share/,mmoser.cinnabar.feralhosting.com,/share/,"Blu-ray movies and a couple TV shows (Breaking Bad/The Newsroom)",1361253759,14,301
http://mitch.spinel.feralhosting.com/,mitch.spinel.feralhosting.com,/,"Blu Rays, DVDs, TV Shows, and Music.",1361253504,15,301
http://www.chrismuise.com/larryp/My%20eBooks/,www.chrismuise.com,/larryp/My%20eBooks/,"A collection of Kindle ebooks (.mobi format)",1361252721,28,404
http://89.20.158.37/,89.20.158.37,/,"Very large directory of TV/Movies/Games/Software/Books/Music",1361252210,28,
http://5.39.76.10/banana/downloads/,5.39.76.10,/banana/downloads/,"TV Shows, Movies and Anime (mostly all 720p/1080p)",1361252046,9,404
http://jiffypop23.sexxxy.biz/external/,jiffypop23.sexxxy.biz,/external/,"Anime, Cartoons, Movies, Shows",1361241593,6,404
http://domuchevil.com/download/,domuchevil.com,/download/,"Few movies, games, software, and some TV shows (including complete series of The Grim Adventures of the Kids Next Door)",1361321182,25,200
http://karma.warywolf.net/pokerSUCKSaCOCK/,karma.warywolf.net,/pokerSUCKSaCOCK/,"Movies and Anime [NSFW]",1361542586,29,
http://floatingworldweb.com/@EBOOKS/@KINDLE/Kindle%20Ebook%20A-Z/,floatingworldweb.com,/@EBOOKS/@KINDLE/Kindle%20Ebook%20A-Z/,"Kindle eBook Collection (over 1500 ebooks)",1361597536,71,404
http://music.umanitoba.ca/dropbox/HM/Teaching/books/Kindle%20eBook%20Collection(298%20Books)/,music.umanitoba.ca,/dropbox/HM/Teaching/books/Kindle%20eBook%20Collection(298%20Books)/,"Kindle eBook Collection (298 Books)",1361597193,30,
http://www.mmnt.net/db/0/1/82.199.101.173/all_downloads/torrents/Downloaded/,www.mmnt.net,/db/0/1/82.199.101.173/all_downloads/torrents/Downloaded/,"Die Antwoord ...and so much more",1362808372,12,200
http://dl.s01.downloaders.me/,dl.s01.downloaders.me,/,"Large Mix of Shows, Software, Movies, Andriod Apps",1362932879,23,
http://www.mousetraining.co.uk/training-manuals/,www.mousetraining.co.uk,/training-manuals/,"Training Manuals for various softwares",1363049561,33,404
http://www.projektjunkies.com/pjsounds/Dubstep/,www.projektjunkies.com,/pjsounds/Dubstep/,"Tons of Dubstep tunes",1363833475,19,
http://www.digininja.org/blog/analysing_amazons_buckets.php,www.digininja.org,/blog/analysing_amazons_buckets.php,"Scour amazon's buckets",1364518466,41,301
http://dl.arrakis-online.com/,dl.arrakis-online.com,/,"Games, Movies and Programs unsorted (French)",1364853096,11,401
http://acifip.com/downloads/,acifip.com,/downloads/,"Large mixed content directory dated 2008-2013",1364781870,17,
http://ks393519.kimsufi.com/ice/files/,ks393519.kimsufi.com,/ice/files/,"Mix of Content:Movies, TV Shows, Console ROMs, Games",1364781583,13,
http://deadfish.chmuranet.net/hanik/,deadfish.chmuranet.net,/hanik/,"Animes (720p)",1364920185,38,
http://s3v3n7.cerulean.feralhosting.com/download/,s3v3n7.cerulean.feralhosting.com,/download/,"French series, movies and some games",1364920032,13,301
http://katiska.dy.fi/data/public/,katiska.dy.fi,/data/public/,"movies and series (720 and 1080p), games and some music",1364868353,66,404
http://win.karsiyaka.com/c/,win.karsiyaka.com,/c/,"Game of Thrones S03E01 and stuff",1365151875,24,404
http://www.infoworld.com/t/cloud-security/amazon-s3-storage-buckets-set-public-are-ripe-data-plundering-215349?1=1,www.infoworld.com,/t/cloud-security/amazon-s3-storage-buckets-set-public-are-ripe-data-plundering-215349,"one in six Amazon Simple Storage Service (S3) buckets' contents can be accessed",1365289137,39,301
http://apple2forever.ca/Apple2/,apple2forever.ca,/Apple2/,"Nostalgic Apple 2 Archive: Games, Utils, Books, Magazines, Videos & Emulators",1365209927,21,
http://droobie.com/complete/,droobie.com,/complete/,"Mix of Content- Audiobooks, TV, Movies, Music,E-Books",1365203216,22,401
http://muteam.fm/dl,muteam.fm,/dl,"Large music directory.",1365336808,32,
http://files.taylorlapeyre.me/treasure/berks/,files.taylorlapeyre.me,/treasure/berks/,"A collection of useful programming books (K&R, Clean Code, Head First, etc.)",1366159743,51,
http://www.binarytides.com/google-hacking-tutorial/,www.binarytides.com,/google-hacking-tutorial/,"Google hacking tutorial (x-post from /r/hacking)",1366707734,51,200
http://servv89pn0aj.sn.sourcedns.com/~gbpprorg/2600/pdf/,servv89pn0aj.sn.sourcedns.com,/~gbpprorg/2600/pdf/,"old issues of 2600",1366848956,59,
http://vieuphonik.com/music/,vieuphonik.com,/music/,"Small music directory. (Over 50mb, so no CC)",1367618421,25,200
ftp://173.60.110.51/,173.60.110.51,/,"Is FTP ok? Small Directory some music, lots of old ROMs, a couple python books, linux images.",1368177129,3,
http://www.theappliedvisual.com/the-exclusive-list-of-paid-and-free-directories,www.theappliedvisual.com,/the-exclusive-list-of-paid-and-free-directories,"The Exclusive List of Paid and Free Directories",1368165887,0,200
http://st3ph.com/downloads/,st3ph.com,/downloads/,"Small Mix of Movies, PC Games",1368354558,38,302
http://www.gameoz.net/games/,www.gameoz.net,/games/,"Huge amount of Flash Games in this Directory",1368657016,18,302
http://www.cell11.com/download/android/,www.cell11.com,/download/android/,"Android Games and Applications",1368656833,1,404
http://bhfiles.com/files/,bhfiles.com,/files/,"Past & Current Blizzard PC Games Hacks, Mods, Patches",1368656309,10,200
http://files.jchew.com/ebooks/,files.jchew.com,/ebooks/,"Large collection of ebooks, ranging from Hawking to Asimov to G R.R. Martin",1368632579,66,
http://s1.music3nter6.ir/Film/,s1.music3nter6.ir,/Film/,"Good sized directory of movies",1368662066,33,
http://otrsounds.com/OTR/,otrsounds.com,/OTR/,"Old Time Radio Programs Archive",1368850788,27,
http://e-bookmobile.com/KindleBooks/,e-bookmobile.com,/KindleBooks/,"A massive directory of Kindle (.mobi) books!",1369335941,8,200
http://e-bookmobile.com/KindleBooks/CalibreLibrary%201/,e-bookmobile.com,/KindleBooks/CalibreLibrary%201/,"An ebook directory",1369407545,35,200
http://www.atenlabs.com/camwar/index.php,www.atenlabs.com,/camwar/index.php,"I'm gonna watch some cams, only got camwar as my homepage. I-I'm front-paging, lookin' for some suckas, This. Is. Fck!ng. Awesome.",1369635396,122,302
http://ryan.kaplan.name/downloads/iacvlvs/,ryan.kaplan.name,/downloads/iacvlvs/,"TV: Entire Six Feet Under series, Alias, Game of Thrones, Dexter...",1369774961,15,
http://www.webpurge.com/colorado/v/,www.webpurge.com,/colorado/v/,"Some movies, some series.",1369898991,37,
http://urpatogh6.persiangig.com/image/postp/National-Geographic/,urpatogh6.persiangig.com,/image/postp/National-Geographic/,"25 Nat Geo Photo Contest Entries",1370131929,17,200
ftp://76.23.52.7/AiDisk_a1/eBooks/,76.23.52.7,/AiDisk_a1/eBooks/,"eBook Directory (With some other unventured stuff)",1370497110,17,
http://practicedomain.com/comics/,practicedomain.com,/comics/,"A few comic directories.",1370778560,35,200
http://www.ncl.com/csimages/,www.ncl.com,/csimages/,"Norwegian Cruise Lines - mostly website images, a few financial documents, promo codes, etc.",1371005646,15,301
http://www.galleries.celebs.movies.pluzmedia.com/albums/pictures/,www.galleries.celebs.movies.pluzmedia.com,/albums/pictures/,"Paparazzi photos of... everyone. Enjoy.",1371306539,18,200
http://sharebox.dyndns.org/upload/,sharebox.dyndns.org,/upload/,"Small Mix of Movies, PC Games, Apps & Music",1371284403,29,
http://pouyadownload.ir/,pouyadownload.ir,/,"Apps, games, a few movies and ebooks",1371477022,31,
http://216.115.3.26/,216.115.3.26,/,"Lots of movies, tv shows, music, and some books.",1371849306,44,301
http://tmp.wwjdtd.net:8080/Public/Games/PC/HumbleBundle/,tmp.wwjdtd.net:8080,/Public/Games/PC/HumbleBundle/,"Dungeon Defenders - Just the one file",1372062741,29,200
http://worldtracker.org/media/library/,worldtracker.org,/media/library/,"A BIG archive of files on various topics, from survival, to improvised silencers, to lockpicks and calculus.",1372250256,43,302
http://www.futuretg.com/FTHumanEvolutionCourse/FTFreeLearningKits/,www.futuretg.com,/FTHumanEvolutionCourse/FTFreeLearningKits/,"Tons of educational eBooks",1372314813,52,404
http://www.thepostmarks.com/sightsnsounds/audio/,www.thepostmarks.com,/sightsnsounds/audio/,"some mp3s from The Postmarks",1372691250,8,301
http://www.jgregg.com/pub/Ultimate%20Marvel%20-%20Complete%20(as%20of%2021-11-07)/,www.jgregg.com,/pub/Ultimate%20Marvel%20-%20Complete%20(as%20of%2021-11-07)/,"Marvel Ultimate comics collections",1372771314,62,404
http://aron.nu/a/Music/,aron.nu,/a/Music/,"[music] Huge collection of music albums mostly in m4a format sorted alphabetically",1373200864,41,302
http://stevencreech.com/Nook/,stevencreech.com,/Nook/,"[ebooks][comics] Various books in epub format (such as song of fire and ice, warhammer 40k miniature rule books) and a couple of comics (such as Batman Yr one and Old Man Logan)",1374898383,56,401
http://www.flickr.com/photos/herosjourneymythology45surf,www.flickr.com,/photos/herosjourneymythology45surf,"Not sure if this is the right place, but this flickr account offers huge 20+MP bikini photos for downloading. 10s of thousands of photos.",1375745461,98,200
http://download.adamas.ai/dlbase/ebooks/VX_related/,download.adamas.ai,/dlbase/ebooks/VX_related/,"Large Directory of Unique EBooks About Computers,Mathematics,CyberSecurity,CryptoLogic, Hacking,ComputerViruses,Logic,Advanced Information Security Systems, Technological+Security Related Topics",1377460435,50,200
http://www.federaljack.com/ebooks/Consciousness%20Books%20Collection/,www.federaljack.com,/ebooks/Consciousness%20Books%20Collection/,"Index of /ebooks/Consciousness Books Collection",1377449655,18,200
http://sotsummercamp.ncat.edu/share/,sotsummercamp.ncat.edu,/share/,"Computer/Hacking/Tech related study guides + tutorials",1377627194,45,
http://arcarc.xmission.com/Pinball/PDF%20Pinball%20Manuals%20and%20Schematics/,arcarc.xmission.com,/Pinball/PDF%20Pinball%20Manuals%20and%20Schematics/,"Index of Pinball Manuals in PDF Form",1377906000,55,200
http://sextreffen.amateure-ficken.net/bilder/,sextreffen.amateure-ficken.net,/bilder/,"Just a ton of NSFW pics.",1378523190,45,403
http://tgv777.free.fr/Sheetmusic/SongBooks/,tgv777.free.fr,/Sheetmusic/SongBooks/,"Index of sheet music",1378784194,40,404
http://kmspublishing.com/books/,kmspublishing.com,/books/,"Index of publications from KMS publishing",1378861856,21,
http://www.listen77.com/mp3s/,www.listen77.com,/mp3s/,"French radio station's music collection (Listen 77 FM)",1379515237,7,200
http://get-wireless.co.uk/eBooks/,get-wireless.co.uk,/eBooks/,"Directory with Ebooks",1379502725,8,403
http://kilofox.com/ebooks/,kilofox.com,/ebooks/,"Lots and lots of Kindle books",1379495536,72,
http://www.mvkworld.com/eBooks/pages/,www.mvkworld.com,/eBooks/pages/,"Directory with lots of Ebooks",1379490887,25,302
ftp://ftp.fixme.ch/free_for_all/Ebook/IT%20eBooks/,ftp.fixme.ch,/free_for_all/Ebook/IT%20eBooks/,"IT eBooks",1379885923,39,
http://nausetee.net/other/BigFiles/E-Books/,nausetee.net,/other/BigFiles/E-Books/,"epub site with interesting author list",1379989000,25,404
http://www.delsoluk.com/trls/katherine/,www.delsoluk.com,/trls/katherine/,"A bunch of Stephen King ebooks, and a couple of other similar kinds of authors",1379988073,31,403
http://www.thegangbangauditions.com/trial/content/upload/,www.thegangbangauditions.com,/trial/content/upload/,"Ummm... a lot of porn.",1380197704,66,200
http://archmagev.com/1st_Ed/,archmagev.com,/1st_Ed/,"1st and 2nd Edition Advanced Dungeons & Dragons Books, Modules",1380446538,49,200
ftp://ftp.mingledorffs.com/Tech_Service/Bulletins/,ftp.mingledorffs.com,/Tech_Service/Bulletins/,"Carrier A/C Dealer Service Bulletins",1380579628,27,200
http://www.runningcamps.org/,www.runningcamps.org,/,"Running Camps public FTP directory -- Some interesting stuff here... [NYUD not working with this site]",1380500837,16,504
http://amateurspictures.n-79.com/gallery_images/,amateurspictures.n-79.com,/gallery_images/,"A whole lot of directories of nakedness",1380593832,36,
http://vkgfx.com/scores/,vkgfx.com,/scores/,"A fair collection of musical scores",1380582943,19,401
http://www.247jfk.com/rave/bowie/DavidBowie/,www.247jfk.com,/rave/bowie/DavidBowie/,"Most of a Bowie Discography",1380669572,49,
http://criticalunity.org/files/,criticalunity.org,/files/,"Tinfoil hats, survivalism, conspiracy theories, alien abductions...",1380841100,36,403
http://www.utku618.org/depo/ebook/kindle_book/,www.utku618.org,/depo/ebook/kindle_book/,"Kindle ebooks, azw and mobi. Nice author list",1380854904,56,
http://www.darelfen.com/albums/,www.darelfen.com,/albums/,"Huge music directory...",1381203418,19,
http://propertyistheft.net/files/D&D/,propertyistheft.net,/files/D&D/,"Excellent D&D Repository. Roll d20, please.",1381530402,43,302
http://62.163.120.92,62.163.120.92,"","Extensive recent (and some older) music directory",1381538362,19,
http://cheap-tech-support.com/books/,cheap-tech-support.com,/books/,"All the personal improvement help you could need...",1381628713,30,
http://152.46.13.240/MoodleContent/,152.46.13.240,/MoodleContent/,"North Carolina Virtual Public School (no nyud.net)- Study Modules, Tests, and some Answers",1381788866,15,403
http://klav.ma3x.org/Music/,klav.ma3x.org,/Music/,"Music Library",1381788211,16,
http://www.techgenie.ca/geektron.net/tf/downloads/admin/,www.techgenie.ca,/geektron.net/tf/downloads/admin/,"Current movies and shows, and some NSFW",1381830452,48,404
http://merung.net/DandD3.5/,merung.net,/DandD3.5/,"Dungeons and Dragons 3.5",1381807757,10,
http://ebook.yesilperi.net/kitaplar/,ebook.yesilperi.net,/kitaplar/,"Directory with lots of Ebooks",1382131701,45,404
http://luizfernando.info/pbd/,luizfernando.info,/pbd/,"Mythological, ancient history and some misc pdfs",1382124337,21,
http://mp3.tamahome.ru/music/utuku/,mp3.tamahome.ru,/music/utuku/,"Index with music mp3s (trance,dubstep,various other electronic +kingston style music)",1382179129,21,
http://www.howjsay.com/mp3/,www.howjsay.com,/mp3/,"Index of mp3 audio files from a word pronunciation dictionary(english)",1382170142,20,200
http://www.obinge.com/books/MobiFiles/,www.obinge.com,/books/MobiFiles/,"another directory of ebooks",1382166355,43,404
http://www.chrismuise.com/larryp/,www.chrismuise.com,/larryp/,"Breaking Bad - 8 Eps of S05 (mkv format) + misc",1382300242,12,200
http://archive.totalism.org/,archive.totalism.org,/,"Lots of intellectual pdfs-Philosophy,Literature,Political Systems,Economic Theory,Humanities,Psychology Theology,etc.",1382290547,30,200
http://66.18.210.80/manuals/,66.18.210.80,/manuals/,"Technical Guides/Installation/Product Manuals + Catalogs for HVAC,Electrical,Boiler,Gas,Plumbing,Pressure etc. systems and machinery components",1382277228,30,
http://4u2locate.com/Music/,4u2locate.com,/Music/,"directory with music files (variety-mostly 80s and 90s rock+pop but also has some country,soundtracks,oldies,etc.)",1382264742,19,404
http://open3.izhamovie.com/BT/,open3.izhamovie.com,/BT/,"movies,music,tv shows,books,big section of small business books etc.",1382348797,6,200
http://isabell.paradise.gen.nz/Bookbinding/,isabell.paradise.gen.nz,/Bookbinding/,"small collection of Bookbinding pdfs-step by step instructions teach you how to bind + sew books in a variety of styles",1382345519,16,200
http://transistori.net/~oh6gzt/putkizone.com/~gzt/pdf/,transistori.net,/~oh6gzt/putkizone.com/~gzt/pdf/,"HUGE collection of DIY electrical projects pdfs-antennas,recievers,amplifiers,repeaters,transverters,transceivers,decoders,descramblers,and a whole lot more!",1382341534,87,
http://www.foxtextile.com,www.foxtextile.com,"","Sundry newer music",1382341155,8,200
http://www.valleyradioclub.org/Misc%20PDF%20Files/,www.valleyradioclub.org,/Misc%20PDF%20Files/,"more DIY pdfs- lots of Instructables and some from other similar sources for electronic projects + hacks",1382453782,24,302
http://www.fiddleicious.com/pdf/,www.fiddleicious.com,/pdf/,"musical scores pdfs-traditional Scottish, Irish, Quebecois, and Acadian folk music",1382433292,19,301
http://ohkawa.cc.it-hiroshima.ac.jp/AoPS.pdf/MathTextBook/,ohkawa.cc.it-hiroshima.ac.jp,/AoPS.pdf/MathTextBook/,"Math textbook pdfs-Algebra,Calculus,Algorithms,Geometry,Probabilityetc.",1382431252,37,
"http://nulleparthigher.free.fr/temp/Mega%20pack%20of%20Sex%20ebooks/pdf's/",nulleparthigher.free.fr,"/temp/Mega%20pack%20of%20Sex%20ebooks/pdf's/","Presented without comment (at least for now): PDF ebooks about sex",1382785164,31,403
http://www.kellyhall.co.uk/wp-content/gallery/,www.kellyhall.co.uk,/wp-content/gallery/,"Lots of sets of a model named Kelly Hall. Let's assume she's missing clothes.",1382778579,24,404
http://muscu.mrim.free.fr,muscu.mrim.free.fr,"","Films of the adult variety",1382778222,37,403
http://frywap.com/load/Hollywood%20Movies/,frywap.com,/load/Hollywood%20Movies/,"Nice dir of recent movies",1382777686,34,
http://www.hotgirlsofamerica.com/wp-content/gallery/,www.hotgirlsofamerica.com,/wp-content/gallery/,"Hot girls of America. Well, Florida mostly.",1382938620,29,200
http://library.worldtracker.org/,library.worldtracker.org,/,"Mostly non-fiction ebook collection: manuals, maps, reference books, textbooks, NatGeo collection, etc.",1383088603,16,302
http://www.fetish-lands.com/,www.fetish-lands.com,/,"Pretty Sizable gallery of BDSM related photos. [NSFW]",1383011852,2,200
http://library.uniteddiversity.coop/Ecological_Building/,library.uniteddiversity.coop,/Ecological_Building/,"Ecological Building Pdfs",1383175443,29,200
"http://boeken.mauritsmisana.nl/Engelse boeken/",boeken.mauritsmisana.nl,"/Engelse boeken/","Hundreds of .epub ebooks, uncategorized, sorted mostly by author name.",1383127058,46,404
http://hotass69.com/wp-content/uploads/2013/,hotass69.com,/wp-content/uploads/2013/,"In case you weren't sure from the domain name, it's lots of porn pics, seems to be mostly scraped from tumblr",1383209956,32,
https://jogins.com/media/Others/ibook/Huge.Collection/Huge.Collection_KINDLE/,jogins.com,/media/Others/ibook/Huge.Collection/Huge.Collection_KINDLE/,"Large .mobi Kindle ebook directory",1383188708,26,
http://mattzdon.dyndns.org/ONE/incoming/,mattzdon.dyndns.org,/ONE/incoming/,"Recent movies, ebooks, etc...",1383188130,28,
http://www.gtfo.org/books/,www.gtfo.org,/books/,"GTFO! An epub directory with lots of fiction series...",1383187537,70,200
http://sirius.auchtober.com/Jayne/BOOKS/Fiction/,sirius.auchtober.com,/Jayne/BOOKS/Fiction/,"Big ebook directory, and well organized!",1383336419,55,404
http://www.users.on.net/~jarkoh/Books/,www.users.on.net,/~jarkoh/Books/,"epub books including recent NYT bestsellers...",1383270789,26,200
http://www.sex-unfall.com/wp-content/bilder/2009/,www.sex-unfall.com,/wp-content/bilder/2009/,"Lots of NSFW images",1383433371,0,403
http://cachrafmercier2.free.fr/Mes%20images/Katie%20Fey%20Blog/,cachrafmercier2.free.fr,/Mes%20images/Katie%20Fey%20Blog/,"Someone really likes Katie Fey...",1383421596,41,404
http://dll1.ipno30.com/zik/,dll1.ipno30.com,/zik/,"Music - lots of albums - variety, house, techno, funk, 80's, French music",1383455707,14,401
