URL,NETLOC,PATH,TITLE,TIME_GMT,SCORE,STATUS
http://www.simdoctor.com.br,www.simdoctor.com.br,"","SimDoctor - Sistema Inovador Modular - é conhecido como um sistema MultiFuncional. Ou seja, inúmeros serviços pelo preço de quase nenhum. Não entendeu? Eu explico. Você, adquire este sistema de automatização para seu consultório ou clínica.",1479250153,0,200
http://www.nwcic.com/private/handouts/,www.nwcic.com,/private/handouts/,"A sample contract and proposal (pdf) for a small business",1246458054,6,404
http://farky.co.uk/,farky.co.uk,/,"Motivational audio files...not really my bag, but I know a lot of people love this stuff.",1246457258,4,
http://www.gowebhoster.com/spanish/,www.gowebhoster.com,/spanish/,"Yo quiero Spanish Lessons?",1246450453,7,200
http://cubicle.fi/~tripper/Cubicle/temp/,cubicle.fi,/~tripper/Cubicle/temp/,"Big directory filled with paranoia paraphernalia ",1246449276,2,200
http://www.lax-it.ca/hgm/routines/,www.lax-it.ca,/hgm/routines/,"Various workout routines, worksheets and exercise programs (xls, doc and zip formats)",1246947351,10,
http://withoutparachute.net/p90x/?C=M;O=A,withoutparachute.net,/p90x/,"P90X (exercise program) Calendar and Worksheet (pdf)",1246946449,13,
http://veradio.com/sounds/,veradio.com,/sounds/,"a bunch of different music",1246941442,9,301
http://rkkwap.com/Ringtones/MP3%20Ringtones/Funny%20Tones/,rkkwap.com,/Ringtones/MP3%20Ringtones/Funny%20Tones/,"Some ""funny"" ringtones...I'm not vouching for how funny they are, however...",1246934421,2,
"http://www.devilsrage.com/iphone/Ringtones/MP3%20Ringtones/Mp3%20Ringtones%20-%205,681%20Vzw/",www.devilsrage.com,"/iphone/Ringtones/MP3%20Ringtones/Mp3%20Ringtones%20-%205,681%20Vzw/","The damn motherload of mp3 ringtones...5,000+",1246931293,16,
http://keithmcgee.com/Ringtones/,keithmcgee.com,/Ringtones/,"Mixture of mp3, mid and wav ringtones",1246890683,5,302
http://www.xzibitcentral.com/audio/ringtones/,www.xzibitcentral.com,/audio/ringtones/,"Yo Dawg, I heard you like ringtones!?",1246890579,7,301
http://shaunmccjr.com/m/mp3%20ringtones/Ringtones/,shaunmccjr.com,/m/mp3%20ringtones/Ringtones/,"Some mp3 ringtones",1246890381,5,
http://www.defdc.com/Pub/Old/,www.defdc.com,/Pub/Old/,"Bunch of random stuff (I see the final Trailer Park Boys episode)",1247032081,2,
http://resource.uvsc.edu/~lynda/Flash/Flash%20CS3%20Professional%20Essential%20Training/,resource.uvsc.edu,/~lynda/Flash/Flash%20CS3%20Professional%20Essential%20Training/,"Flash CS3 Professional Essential Training (mov videos)",1247030594,8,
http://www.ticklenotes.com/files/videos/,www.ticklenotes.com,/files/videos/,"Psychology related videos, documentaries, and discussions (avi and wmv)",1247029393,5,
http://www.ticklenotes.com/files/tests/,www.ticklenotes.com,/files/tests/,"Psychological tests",1247029277,4,
http://www.ticklenotes.com/files/career/,www.ticklenotes.com,/files/career/,"Career development / guidance literature (self help)",1247029149,2,
http://www.ticklenotes.com/files/public%20speaking/,www.ticklenotes.com,/files/public%20speaking/,"Video, audio and text on Public Speaking (self help)",1247029063,2,
http://www.worstpresident.com/alex_jones/documentaries/,www.worstpresident.com,/alex_jones/documentaries/,"Alex Jones documentaries",1247028836,4,302
http://www.organizm.se/PLACES/ALBUM/videos/,www.organizm.se,/PLACES/ALBUM/videos/,"Urban exploration videos",1247028696,10,404
http://soundlib.noisetheorem.com/synthlib/,soundlib.noisetheorem.com,/synthlib/,"Well organized collection of synthesizer samples",1247016386,10,
http://soundlib.noisetheorem.com/drumlib/,soundlib.noisetheorem.com,/drumlib/,"Well organized collection of drum samples (both real and electronic)",1247016263,4,
http://theteamonline.com/files/PS-01%20WAV%20Hip%20Hop%20&%20RnB%20Loops/,theteamonline.com,/files/PS-01%20WAV%20Hip%20Hop%20&%20RnB%20Loops/,"Hip Hop and RnB Loops, organized by BPM",1247014926,15,501
http://www.rcub.bg.ac.yu/~ggajic/pub/wallpapers/,www.rcub.bg.ac.yu,/~ggajic/pub/wallpapers/,"Some nice nature wallpapers (with thumbnails)",1247014149,14,
http://www.archive.org/index.php,www.archive.org,/index.php,"Thousands of live concerts, millions of books... Archive.org",1246978918,14,302
http://www.theonlyandone.com/video/techtv/,www.theonlyandone.com,/video/techtv/,"A bunch of old Tech TV videos (mostly wmv)",1246977048,6,
http://realmunity.net/filters/,realmunity.net,/filters/,"Photoshop Plugins / Filters",1246967507,11,
http://ftp.gaby.de/pub/,ftp.gaby.de,/pub/,"Stuff for old operating systems (CP/M, DOS, Win3x)",1247115002,8,200
http://frogcalls.home.mindspring.com/mp3s/,frogcalls.home.mindspring.com,/mp3s/,"Frog calls",1247111064,4,200
http://www.randombase.com/mp3/mp3_25/,www.randombase.com,/mp3/mp3_25/,"Another huge collection of MP3s - change last 2 digits in URL to go to other pages",1247105151,0,
http://digitalcypher.com/random/?C=M;O=A,digitalcypher.com,/random/,"Large collection of ""funny|NSFW|WTF"" images.",1247096849,12,200
http://superiorbeing.net/dnd/DND4E/,superiorbeing.net,/dnd/DND4E/,"DnD 4e Books (rar contains all core books)",1247089988,16,404
http://www.artofroam.com/Wallpapers/,www.artofroam.com,/Wallpapers/,"Variety of wallpapers (women directory is NSFW)",1247014618,41,
http://www.explosionsandboobs.com/explosions/,www.explosionsandboobs.com,/explosions/,Explosions.,1247180731,4,200
http://www.dansansworld.com/misc/stuff/,www.dansansworld.com,/misc/stuff/,"Looks like a bachelor party [nsfw]",1247134436,6,
http://www.downthemall.net/,www.downthemall.net,/,"Down Them All, The Best multiple file download tool you could ever want or need.",1247151690,36,200
http://www.thejshow.com/snowy/Nerdcore/,www.thejshow.com,/snowy/Nerdcore/,"The motherload of nerdcore mp3s (and a documentary about the nerdcore genre under 'Videos')",1247103271,12,302
http://www1.videofilia.com/golfillas/,www1.videofilia.com,/golfillas/,"huge directory of amateur porn pics",1247231164,2,
http://urbanbushpeople.org/survival/,urbanbushpeople.org,/survival/,"Survival documents (pdf, doc, txt, etc.)",1247372648,22,
http://www.experimentalistsanonymous.com/diy/Schematics/,www.experimentalistsanonymous.com,/diy/Schematics/,"DIY schematics for making your own musical effects / filters / pedals / boxes",1247371473,18,200
http://www.drop.io/quickColab,www.drop.io,/quickColab,"Not exactly a open *directory* but, it has 1.2gb of 
music and 800mb free space.",1247433896,7,403
http://www.how-to-speak.com/spanish/informal/,www.how-to-speak.com,/spanish/informal/,"Informal Spanish Lessons (mp3)",1247544159,3,200
http://www.gerpe.info/,www.gerpe.info,/,"A couple books on how to draw heads, hands and girls",1247543836,4,200
http://prernalal.com/banned%20books/,prernalal.com,/banned%20books/,"Banned Books (pdf files)",1247536562,21,404
http://flirkin.com/wp-content/gallery/,flirkin.com,/wp-content/gallery/,"NSFW jpgs",1247474435,30,302
http://www.tauthal.com/Weekly%20Broadcasts/,www.tauthal.com,/Weekly%20Broadcasts/,"Awesome music collection - Led Zeppelin, Bob Dylan, Bob Marley, The Clash, Pink Floyd , Radiohead, Grateful Dead, The Band, Flaming Lips, Guns n Roses... Too many good ones to mention. [open directory] ",1247604822,61,302
http://bunnitude.com/misc/,bunnitude.com,/misc/,"Here, have my /misc/ directory; see if you can find 
any nuggets. I've forgotten half of what's in there. 
I use it for misc. file hosting.",1247591654,5,302
http://djk1rby7.com/audio/,djk1rby7.com,/audio/,"A bunch of miscellaneous audio.",1247572486,1,
http://www.thejshow.com/snowy/Nerdcore/Mc%20900%20ft%20Jesus/,www.thejshow.com,/snowy/Nerdcore/Mc%20900%20ft%20Jesus/,"MC 900 Ft Jesus, maybe you heard of him back in the early 90's.  Check out ""The City Sleeps"", on Welcome to My Dream, if you're not familiar",1247704776,12,302
http://polux.blog.free.fr/poluxzik/,polux.blog.free.fr,/poluxzik/,"Lots of unsorted techno!",1247702627,1,403
http://files.tophattwaffle.com/Dungeons%20and%20Dragons/Books/,files.tophattwaffle.com,/Dungeons%20and%20Dragons/Books/,"D&D Books Found",1247740100,21,
http://blandhand.net/listen/verified/,blandhand.net,/listen/verified/,"Odd mix. Buff Medways, The Carter Family, Tom Waits, Captain Beefheart, Cat Power, Beethoven, etc.  Some flac albums in the flac directory (duh).",1247899615,7,404
http://hlzr.net/files/music/,hlzr.net,/files/music/,"Small directory. Stooges,  Faust, Nick Cave",1247899014,4,404
http://stickystockings.com/files/Archive/Flipfix/,stickystockings.com,/files/Archive/Flipfix/,"Lots of well organized 70's and 80's music hosted on a foot fetish site. Main site is NSFW but the directory is not.",1247897891,5,302
http://djmannes.com/Penned/MP3/Manley/,djmannes.com,/Penned/MP3/Manley/,"If you like electronic/dance music, there are some really great remixes and mashups in here",1247839691,10,
http://www.kaake.net/RON/,www.kaake.net,/RON/,"More good hip hop, check out K-OS...Also some nice old blues from Howlin Wolf",1247839089,1,200
http://mychillisplayhouse.com/Mp3/random/bongboi420/CunninLynguists/,mychillisplayhouse.com,/Mp3/random/bongboi420/CunninLynguists/,"If you want to try some good hip hop, check out Cunninlynguists",1247838266,3,404
http://fv911truth.org/music/,fv911truth.org,/music/,"9/11 Conspiracy Theory Music",1247837838,0,301
http://user.lt/~kornaz/music/,user.lt,/~kornaz/music/,"A whole-lotta electronic / dubstep / trance / chillout music.  (great music for focusing your productivity in front of the 'puter)",1247834538,2,301
http://affectmedia.com/users/zejoku/music/,affectmedia.com,/users/zejoku/music/,"Zip archives of various alt/indie rock albums.
The Faint, New Model Army, New Order, Seabound and many more. 92 zipped albums in total.",1247985218,4,404
http://hotwifehouse.com/images/,hotwifehouse.com,/images/,"NSFW Images",1247976541,6,301
http://server1.gigawire.com.br/JAZZ/,server1.gigawire.com.br,/JAZZ/,"Twenty archives (zip) of classic jazz.  MP3s in the archives are 320kbps.",1247960120,26,
http://www.gadgt.com/media/Music/,www.gadgt.com,/media/Music/,"For all of you Windows Media users out there. Here are 72 directories of .WMA files.  A lot of metal and classic rock in there.",1247958354,3,404
http://apt.jonwarren.org/,apt.jonwarren.org,/,"I think you might find something you like in here. 
97 directories of music, some current, some not, most are full albums.",1247956878,10,
http://www.jumpgates.com/matthias/music/music_gothic_angel/,www.jumpgates.com,/matthias/music/music_gothic_angel/,"Need some goth metal?  Amon Amarth, Atrocity, Crematory, My Dying Bride.",1247948047,2,404
http://newhopeweb.net/Audio/Wedding%20Music/,newhopeweb.net,/Audio/Wedding%20Music/,"Ahhhhh, Wedding Music. <3 <3 <3",1247929639,5,
http://213.134.203.22/~kostik/mp3/,213.134.203.22,/~kostik/mp3/,"Russian server with lots of directories.  Some singles, some albums, some empty, some very odd.  Pick and choose what you will.",1247928512,8,
http://www.notfine.com/muse/,www.notfine.com,/muse/,"I can't even begin to tell you how much good alt/indy music is in this one.",1247927367,24,401
http://www.clangfaq.net/downloads/music/,www.clangfaq.net,/downloads/music/,"Directory of albums in archive (zips and rars) Dragonforce, Eminem ans a couple of others.",1247909592,8,302
http://www.osbjmg.com/files/music,www.osbjmg.com,/files/music,"Blink 182 discography and Chunk Palahniuk (""Fight Club"" author) audio book library.  Site is a little weird to navigate.  Details in comment.",1248065646,11,404
http://topekadiy.net/music/chelsea/Chelsea/Punk%20Singles/,topekadiy.net,/music/chelsea/Chelsea/Punk%20Singles/,"Only one album in this one but it is a classic, Chelsea Punk Rock Singles compilation. Chelsea was one of the early London punk rock bands.",1247987394,5,
http://www.adamlaz.com/files/AClingenpeel/Dexter%20Season%203/,www.adamlaz.com,/files/AClingenpeel/Dexter%20Season%203/,"Dexter (Showtime series) Season 3 DivX AVI.",1248089063,14,
http://mihanhub.net/Staff/Masoud/Albums/,mihanhub.net,/Staff/Masoud/Albums/,"Expand your horizons by downloading some (cheesy) Middle Eastern pop.  None is in English, some Persian, some Arabic. Directories arranged by letter then artist. ",1248077511,7,
http://rosuto.paheal.net/Books/,rosuto.paheal.net,/Books/,"A whole boatload of e-books in PDF and text format.
Mostly fiction.",1248233941,16,
http://www.hardcore.lt/mp3/,www.hardcore.lt,/mp3/,"Lithuanian hardcore, punk rock site.  Whether you choose to heed the warning at the top of the page is up to you.  Most of the music is not in English, some is extremely low fi.  Some ska, some thrash.",1248230667,7,301
http://beddha.free.fr/LWR/,beddha.free.fr,/LWR/,"For those fans of Long Way Round, Ewan McGregor and Charlie Boorman's mini-series following their adventures traveling around the world on their bikes, this is a directory to some  excerpts from their book, read aloud by Ewan himself.",1248229998,9,404
http://dl.nin.ru/public/muzak/,dl.nin.ru,/public/muzak/,"Yet another Russian site (What is up with those guys?).  This one has NIN, Coil, The Cure, Dresden Dolls and a few more.",1248223806,14,200
http://htftp.offroadsz.com/marinhaker/drugi/mp3/,htftp.offroadsz.com,/marinhaker/drugi/mp3/,"Soundtracks from the first 5 Rocky films and Tom Jones' Greatest Hits",1248216940,6,200
http://funksion.org/mal/1950%27s%20sex%20education%20vinyl%20(rare)/,funksion.org,/mal/1950%27s%20sex%20education%20vinyl%20(rare)/,"1950's sex education LP ripped to mp3.",1248211934,10,403
http://hagure-metaru.net/music/,hagure-metaru.net,/music/,"Japanese site with quite a bit of music.  It isn't really organized so you kinda have to hunt and peck through the directories to kind stuff.  Katamari Damacy OST, Del Tha Funky Homosapien, Stereolab, n.e.r.d., Silent Hill OST and other albums and some random mp3s of interest.",1248210371,13,301
http://media.sonicstadium.org/Music%20and%20Soundtracks/,media.sonicstadium.org,/Music%20and%20Soundtracks/,"Every Soundtrack from Sonic the Hedgehog.  Bring back those old Sega memories.",1248209311,7,301
http://www.iopb.res.in/~jatis/Songs/Nice_Collection/,www.iopb.res.in,/~jatis/Songs/Nice_Collection/,"Large directory of Indian patriotic music and ghazals.  Some really cool old Bollywood tracks in the ghazal directory.",1248329073,8,302
http://aquarium.lipetsk.ru/MESTA/mp3/indian/,aquarium.lipetsk.ru,/MESTA/mp3/indian/,"Large directory of traditional Indian music.  ",1248317846,23,200
http://www.asikveysel.com/Turkuler/,www.asikveysel.com,/Turkuler/,"Turkish folk music.  Not very high bit rate, but worth a listen.",1248317462,7,200
http://blandhand.net/listen/unverified/,blandhand.net,/listen/unverified/,"Wilco, Violent Femmes, The Duke Ellington Collection, Television, Kimya Dawson, Les Paul, a bunch of world music albums to name a few.",1248261839,13,404
http://www.sadena.com/Books-Texts/,www.sadena.com,/Books-Texts/,"A collection of text and audiobooks (Dawkins, Ann Rice, Douglas Adams, Stephen Hawking, and more)",1248416127,18,
http://www.googletutor.com/2005/04/15/voyeur-heaven/,www.googletutor.com,/2005/04/15/voyeur-heaven/,"How to find unprotected content via Google",1248349948,45,403
http://sweethell.biz/Mp3z/,sweethell.biz,/Mp3z/,"Decent collection of music sorta arranged by genre.",1248497317,1,
http://samples.edge6.com/,samples.edge6.com,/,"Old repository of samples in wav, au, sbk and other formats, (kind of) oragnized.",1248431107,3,
http://www.demonofdreams.org/Music/,www.demonofdreams.org,/Music/,"Some VNV Nation, Apoptygma, Lords of Acid: small but pretty good",1248577651,6,
http://nsn.moep.net/Weeds%20Season%201-3/,nsn.moep.net,/Weeds%20Season%201-3/,"Weeds Season 1 to 3 XviD AVI - [Repost with .nyud.net added]",1248533667,17,403
http://img3361.imagevenue.com/images/,img3361.imagevenue.com,/images/,"Lots of [NSFW] pics (watch out for thumbs)",1248626384,7,403
http://www.radivizija.com/andric/Primus%20-%20Frizzle%20Fry%20%281990%29/,www.radivizija.com,/andric/Primus%20-%20Frizzle%20Fry%20%281990%29/,"Primus - Frizzle Fry (and some randoms in parent dir)",1248603224,4,302
http://www.wuala.com/Interaction%20and%20Emotional%20Design/Documents/,www.wuala.com,/Interaction%20and%20Emotional%20Design/Documents/,"Some great books (pdf) on graphic design and usability",1248751870,8,
http://johnoheath.com/Music/iTunes%20%3C%202009/iTunes%20Music/,johnoheath.com,/Music/iTunes%20%3C%202009/iTunes%20Music/,"Another shared iTunes directory.  Mostly alt/indy music in this one, but way more than I could possibly list.",1248751769,4,200
http://www.dodeca-t.com/picpile/jud%20jud/,www.dodeca-t.com,/picpile/jud%20jud/,"Jud Jud - x No Tolerance For Instruments x.
Jud Jud was the band that was too straight edge for instruments. Every song consists them chanting their manifesto, which consists mostly of the word Jud.",1248748708,9,404
http://www.laisladelax.com.ar/mp3/,www.laisladelax.com.ar,/mp3/,"A whole lot of music of various genres.  Most in a flat directory and some in separate folders of artist/album.",1248743458,7,
http://ownside.com/re1lik/a/b/,ownside.com,/re1lik/a/b/,"A bunch of hip hop. Some underground, some pop, some cheesy.",1248740724,1,302
http://kuu.net/~kdoherty/fghss/,kuu.net,/~kdoherty/fghss/,"Some random TV shows and random episodes. Hell's Kitchen season 6, Northern Exposure seasons 1-2, Top Chef and some others.",1248735629,2,301
http://pensiunea-retezat.com/transfer/DEXTER/sezon%201/,pensiunea-retezat.com,/transfer/DEXTER/sezon%201/,"Dexter Season 1, High quality DVD rip.",1248733647,5,
http://www.anison.us/temp/,www.anison.us,/temp/,"Huge directory on anime music (anison)/J-Pop most are in archive format (zips and rars).",1248730770,1,
http://hrppro.com/iTunes%20Music/,hrppro.com,/iTunes%20Music/,"Someone's shared iTunes directory.  Not many albums lots of funk, soul, hip hop and 80s.",1248729705,11,301
http://www.everlastingfitness.com/downloads/,www.everlastingfitness.com,/downloads/,"Health and Fitness Stuff",1248848819,4,302
http://astrovault.com/azseamonkey/documentaries/,astrovault.com,/azseamonkey/documentaries/,"Various documentaries on the government, mind control, ufo's, etc. (David Icke, Jordan Maxwell)",1248838560,0,404
http://mu5ic.ru/meditation/,mu5ic.ru,/meditation/,"Having trouble sleeping?  Try listening to some of these soothing sounds as you slowly relax every muscle in your body and begin to drift away...(not sure what the Russian titled directories are)",1248837825,4,200
https://www.japancollection.com/images/upload/,www.japancollection.com,/images/upload/,"Yosh! 2700 Japanese woodblock prints in a flat directory",1248825613,17,
http://load.azalio.net/music/,load.azalio.net,/music/,"Directory of new age, relaxation and meditation music.",1248822622,5,
http://www.joyupao.com/music/,www.joyupao.com,/music/,"Some interesting remixes and dubs.  ",1248821624,3,
"http://emedia.art.sunysb.edu/debt/music/Prefuse 73/",emedia.art.sunysb.edu,"/debt/music/Prefuse 73/","Huge Parent... reposted for Prefuse 73! (appended nyud.net)",1248794444,5,
http://216.215.44.123/~chiefband/iTunes/,216.215.44.123,/~chiefband/iTunes/,"Another shared iTunes directory.  This one is strange it has a bunch of marching band music, some jazz, pop and other stuff.  ",1248929059,3,
http://dsd1.com/pops-%20website%20%281%29/software/hypnosis/Hypnography%20Volume%20I_Erotic%20Hypnosis%20for%20Men/,dsd1.com,/pops-%20website%20%281%29/software/hypnosis/Hypnography%20Volume%20I_Erotic%20Hypnosis%20for%20Men/,"This audio file claims it will make men climax.  Why'd I have to find it at work??  (Hypnography Vol. I - Erotic Hypnosis for Men)",1248840961,49,302
http://joobz.free.fr/musique/,joobz.free.fr,/musique/,"Open directory with mixed reggea/roots/dub. Feat. Iration/Groundation/Alpha&Omega and more",1248991038,16,
http://www.wildfiyah.com/Shaka/,www.wildfiyah.com,/Shaka/,"Live recordings of Jah Shaka from 1982-1989 (roots/dub)",1248990049,0,404
http://www.wordthecat.com/images/,www.wordthecat.com,/images/,"Mixed reggae/roots/dub",1248989423,1,200
http://89.238.137.226/flash/,89.238.137.226,/flash/,"Lots-O-Porn.  Mostly .FLV files. Some hentai stuff which I guess some folks are into.  NSFW!!",1248956113,16,
http://tridity.org/~achernak/Music/,tridity.org,/~achernak/Music/,"Foo Fighter, Mew, NIN, Radiohead, Sigur Ros, and more",1249109825,16,200
http://blogterrorist.com/hendrie/,blogterrorist.com,/hendrie/,"Classic Phil Hendrie bits (if you don't know who he is, you are missing out on some great comedy)",1249094478,13,200
http://www.lowridah.com/~meshuga/keith/mp3/,www.lowridah.com,/~meshuga/keith/mp3/,"Reddit Request fullfillment:  Underground hip hop. Atmosphere, El-P, Hi-Tek etc etc etc. ",1249083226,14,
http://www.onii.net/finklses/hyori2/,www.onii.net,/finklses/hyori2/,"Lee Hyori - Dark Angel (13 mp3s)",1249054250,3,
http://www.onii.net/finklses/girlsontop/,www.onii.net,/finklses/girlsontop/,"BoA - Girls on Top (13 mp3s)",1249053596,0,
http://www.onii.net/finklses/everlasting/,www.onii.net,/finklses/everlasting/,"BoA - Everlasting (5 mp3s)",1249052640,0,
http://www.onii.net/finklses/2006BoAtheLIVEmp3s/,www.onii.net,/finklses/2006BoAtheLIVEmp3s/,"BoA - The LIVE (14 mp3s)",1249051744,0,
http://www.onii.net/finklses/eternalrain/,www.onii.net,/finklses/eternalrain/,"Rain - Eternal Rain"" (12 mp3s)",1249051126,0,
http://www.onii.net/finklses/winterlove/,www.onii.net,/finklses/winterlove/,"BoA's - Winter Love (5 mp3s / 1 album art jpg)",1249050367,1,
http://www.onii.net/dbsk/,www.onii.net,/dbsk/,"DBSK - O. Jung. Ban. Hap."" (12 mp3s / 1 album art jpg)",1249049479,1,
http://www.onii.net/finklses/BoA-OUTGROW/,www.onii.net,/finklses/BoA-OUTGROW/,"BoA's ""OUTGROW"" (14 mp3s / 1 album art jpg)",1249048374,1,
http://man.lupaworld.com/content/,man.lupaworld.com,/content/,"Sort of organized collection of linux, java, and python books",1249162904,6,200
http://deamon.dominion.free.fr/,deamon.dominion.free.fr,/,"Totally epic black metal collection including Immortal, Dissection, Windir, Ablaze My Sorrow, Finntroll and more - Most with lyrics!",1249115332,5,
http://morkleson.net/wp-content/andrew/mp3/,morkleson.net,/wp-content/andrew/mp3/,"Some underground hip-hop and indy rock. Not too organized but plenty to enjoy.",1249110438,2,
http://www.sudancs.com/Books/,www.sudancs.com,/Books/,"Computer Science Books (organized, but all RAR'd, sigh)",1249273676,28,
http://ftdstorage.com/jeremy/,ftdstorage.com,/jeremy/,"Some complete 'indie' albums (generic, but interesting finds too)",1249272733,2,
http://www.faure-dumont.net/BooksAndTutorials/,www.faure-dumont.net,/BooksAndTutorials/,"Small collection of C# and F# ebooks (PDF format)",1249247127,1,
http://radio.marseillegaulthier.info/catalog/,radio.marseillegaulthier.info,/catalog/,"Well-organized little bit o' everything (some electronic, some classic rock, some modern pop, some newer rock)",1249311095,17,
http://www.niahealingcenter.org/music/,www.niahealingcenter.org,/music/,"Many Final Fantasy game soundtracks and some Cowboy Bebop OSTs",1249310881,4,200
http://ninnewsfr.mihalis.org/mp3/Nin%20Versus%20Bauhaus%20-%20Radio%20sessions%20%282006%29/,ninnewsfr.mihalis.org,/mp3/Nin%20Versus%20Bauhaus%20-%20Radio%20sessions%20%282006%29/,"NIN vs Bauhaus (some nin-related items in parent dir)",1249386811,4,200
http://dl.nin.ru/public/muzak/nin/,dl.nin.ru,/public/muzak/nin/,"NIN - more recent stuff, remixes, and some live too",1249385862,5,200
http://jesuslove21.com/centerfolds/search/,jesuslove21.com,/centerfolds/search/,"My old as crap, javascript based Google Open Directory search tool.",1249385079,61,
http://www.burnthewitch.net/outcesticide/index.htm,www.burnthewitch.net,/outcesticide/index.htm,"Outcesticide - Nirvana Bootlegs and Rarities!! (not an open dir, but might as well be.  click the album images then DownThemAll!)",1249383903,15,404
http://sodaphish.com/files/ebks/try2innovate.com/downloads/E-books/,sodaphish.com,/files/ebks/try2innovate.com/downloads/E-books/,"eBooks - CS, EE, Robotics, Linux, IT... (pdf, rar, chm)",1249469814,18,404
http://pturing.firehead.org/occult/,pturing.firehead.org,/occult/,"An Occult Collection (lots of Crowley under /thelema/misc/)",1249580691,21,
http://n.teyan.free.fr/highbass/mixes/,n.teyan.free.fr,/highbass/mixes/,"Massive highbass mixes! Reggae/UK-Roots/Dub Feat. Papa-Jack & Zefyko. Enjoy!",1249676568,9,403
http://www.2p.com.br/fontes_true_type/arquivos/,www.2p.com.br,/fontes_true_type/arquivos/,"Tons of TTF fonts",1249995898,27,200
http://www.hotasiansnude4u.com/sex/,www.hotasiansnude4u.com,/sex/,"(NSFW) Lots of pictures on naked Asian girls. I heard that some of you folks might be into that.",1250561205,3,
http://unisonis.com/~gim/music/,unisonis.com,/~gim/music/,"A whole lot of jazz. Big Band, Swing, Cool, Be Bop, standards etc.  ",1250560068,14,
http://mitchgill.com/vo/Comedy/,mitchgill.com,/vo/Comedy/,"If you need a laugh, you can download some of the stuff from this large directory of comedy albums. Steve Martin, Richard Pryor, George Carlin, Bill Cosby, Smothers Brothers and much, much more.",1250651398,58,404
http://westbuer.net/4kathi/,westbuer.net,/4kathi/,"Some zipped albums.  ¡Forward, Russia!, Hot Chip, Death From Above 1979 and more.",1250590401,5,
http://roc0.free.fr/Prout/,roc0.free.fr,/Prout/,"Klaxons, Dream Theater, Queens Of The Stone Age, Smashing Pumpkins, Wolfmother, Blonde Redhead",1250590088,7,404
http://www.reynoldsons.com/~treynold/docs/beck/,www.reynoldsons.com,/~treynold/docs/beck/,"Fox News conservative whack job Glenn Beck's audio books.",1250579720,0,
http://www.keithatkeith.com/steven/sedaris/,www.keithatkeith.com,/steven/sedaris/,"David Sedaris' ""When You Are Engulfed In Flames"" Audiobook",1250579192,18,500
http://pw.skeiron.net/PDF/?C=S;O=A,pw.skeiron.net,/PDF/,"Physics and Math textbooks",1250729743,20,
http://tinyurl.com/looloh,tinyurl.com,/looloh,"Google open directory search for O'Reilly manuals.",1250732208,5,301
http://files.chicagotribune.com/,files.chicagotribune.com,/,"Chicago tribune files directory",1251260691,0,301
